{"turnId":"11111111-1111-4111-8111-111111111111","threadId":"7c1d2e3f-4a5b-4c6d-8e7f-9a0b1c2d3e4f","scope":{"kind":"all"},"content":"When is invoice 4471 due?","state":"complete","reason":"no_evidence","errorCode":null,"answer":"I found no archived evidence for this question in the selected scope.","claims":[],"gaps":["No matching archived evidence in scope."],"proposals":[],"context":[],"invalidated":false,"withheld":false,"createdAt":"2026-10-08T10:00:00.000Z","completedAt":"2026-10-08T10:00:01.000Z"}
