{"turnId":"11111111-1111-4111-8111-111111111111","threadId":"7c1d2e3f-4a5b-4c6d-8e7f-9a0b1c2d3e4f","scope":{"kind":"all"},"content":"When is invoice 4471 due?","state":"complete","reason":"cloud_allowed","errorCode":null,"answer":null,"claims":[],"gaps":[],"proposals":[],"context":null,"invalidated":false,"withheld":true,"createdAt":"2026-10-08T10:00:00.000Z","completedAt":"2026-10-08T10:00:07.000Z"}
