{"turnId":"11111111-1111-4111-8111-111111111111","threadId":"7c1d2e3f-4a5b-4c6d-8e7f-9a0b1c2d3e4f","scope":{"kind":"all"},"content":"When is invoice 4471 due?","state":"complete","reason":"cloud_allowed","errorCode":null,"answer":"Invoice 4471 is due on October 13. The attachment reported the service healthy as of October 1; nothing says it is healthy now.","claims":[{"text":"Invoice 4471 is due on October 13.","basis":"evidence","citations":[{"chunkId":"aaaaaaaa-aaaa-4aaa-8aaa-aaaaaaaaaaaa:body-v1:0","sourceId":"aaaaaaaa-aaaa-4aaa-8aaa-aaaaaaaaaaaa","attachmentId":null,"page":null,"start":0,"end":56,"excerpt":"Invoice 4471 for synthetic hosting is due on October 13."}]},{"text":"The service was reported healthy as of October 1.","basis":"report","citations":[{"chunkId":"cccccccc-cccc-4ccc-8ccc-cccccccccccc:gen-1:0","sourceId":"aaaaaaaa-aaaa-4aaa-8aaa-aaaaaaaaaaaa","attachmentId":"cccccccc-cccc-4ccc-8ccc-cccccccccccc","page":2,"start":10,"end":40,"excerpt":"Status as of October 1: healthy."}]},{"text":"The invoice may still be unpaid.","basis":"hypothesis","citations":[]}],"gaps":["No payment confirmation was found."],"proposals":[{"kind":"email.reply","targetId":"bbbbbbbb-bbbb-4bbb-8bbb-bbbbbbbbbbbb","description":"Ask the vendor for an itemized invoice."}],"context":[{"sourceId":"aaaaaaaa-aaaa-4aaa-8aaa-aaaaaaaaaaaa","privacy":"hybrid"},{"sourceId":"bbbbbbbb-bbbb-4bbb-8bbb-bbbbbbbbbbbb","privacy":"local_only"}],"invalidated":false,"withheld":false,"createdAt":"2026-10-08T10:00:00.000Z","completedAt":"2026-10-08T10:00:07.000Z"}
